{
  "$schema": "https://json-schema.org/draft/2020-12/schema",
  "$id": "https://ai3dcnc.org/schemas/ops_json.schema.json",
  "title": "ai3dcnc ops json v0.1-lite",
  "type": "object",
  "required": ["version", "units", "board", "ops"],
  "additionalProperties": false,
  "properties": {
    "version": { "type": "string", "const": "0.1-lite" },
    "units": { "type": "string", "enum": ["mm"] },
    "from_finished_edges": { "type": "boolean", "default": true },
    "board": {
      "type": "object",
      "required": ["DL_mm", "DH_mm", "DS_mm", "material", "edge_bands"],
      "additionalProperties": false,
      "properties": {
        "DL_mm": { "type": "number", "minimum": 1, "multipleOf": 0.001 },
        "DH_mm": { "type": "number", "minimum": 1, "multipleOf": 0.001 },
        "DS_mm": { "type": "number", "minimum": 1, "multipleOf": 0.001 },
        "material": { "type": "string", "minLength": 1 },
        "edge_bands": {
          "type": "object",
          "additionalProperties": false,
          "properties": {
            "F": { "type": "boolean" },
            "B": { "type": "boolean" },
            "L": { "type": "boolean" },
            "R": { "type": "boolean" }
          }
        }
      }
    },
    "ops": {
      "type": "array",
      "minItems": 1,
      "items": { "$ref": "#/$defs/op" }
    }
  },
  "$defs": {
    "mm": { "type": "number", "multipleOf": 0.001 },
    "face": { "type": "integer", "minimum": 1, "maximum": 7 },
    "drill": {
      "type": "object",
      "required": ["id", "op", "face", "x_mm", "y_mm", "z_mm", "dia_mm"],
      "additionalProperties": false,
      "properties": {
        "id": { "type": "string", "minLength": 1 },
        "op": { "const": "DRILL" },
        "face": { "$ref": "#/$defs/face" },
        "note": { "type": "string" },
        "x_mm": { "$ref": "#/$defs/mm" },
        "y_mm": { "$ref": "#/$defs/mm" },
        "z_mm": { "$ref": "#/$defs/mm" },
        "dia_mm": { "$ref": "#/$defs/mm", "minimum": 1 }
      }
    },
    "op": { "oneOf": [{ "$ref": "#/$defs/drill" }] }
  }
}
