{
  "version": "0.1-lite",
  "units": "mm",
  "board": { "DL_mm": 800, "DH_mm": 450, "DS_mm": 18, "material": "PB",
    "edge_bands": { "F": false, "B": false, "L": false, "R": false }
  },
  "ops": [
    { "id": "f1_d5",  "op": "DRILL", "face": 1, "x_mm": 100, "y_mm": 100, "z_mm": 10, "dia_mm": 5  },
    { "id": "f1_d6",  "op": "DRILL", "face": 1, "x_mm": 200, "y_mm": 100, "z_mm": 10, "dia_mm": 6  },
    { "id": "f1_d8",  "op": "DRILL", "face": 1, "x_mm": 300, "y_mm": 100, "z_mm": 10, "dia_mm": 8  },
    { "id": "f1_d10", "op": "DRILL", "face": 1, "x_mm": 400, "y_mm": 100, "z_mm": 10, "dia_mm": 10 }
  ]
}
